{
  "id": "6a7b8c9d-0e1f-4a2b-3c4d-5e6f7a8b9c0d",
  "workshop_id": "3f4e5d6c-7b8a-4c9d-0e1f-2a3b4c5d6e7f",
  "title": "Formation du Faire ensemble - Niveau Initiation",
  "description": "Découvrez les fondamentaux de la méthode du Faire ensemble à travers des ateliers pratiques et collaboratifs.",
  "start_time": "2025-11-15T09:00:00Z",
  "end_time": "2025-11-15T17:00:00Z",
  "all_day": false,
  "location": {
    "venue_name": "Centre Culturel de Lyon",
    "street": "25 rue de la Barre",
    "street2": "Salle A - 2ème étage",
    "city": "Lyon",
    "postal_code": "69002",
    "region": "Auvergne-Rhône-Alpes",
    "country": "FR"
  },
  "virtual_meeting_url": null,
  "recurrence_rule": null,
  "participant_ids": [
    "a1b2c3d4-e5f6-4a7b-8c9d-0e1f2a3b4c5d",
    "4d5e6f7a-8b9c-4d0e-1f2a-3b4c5d6e7f8a"
  ],
  "organizer_ids": [
    "a1b2c3d4-e5f6-4a7b-8c9d-0e1f2a3b4c5d"
  ],
  "reminder_settings": {
    "enabled": true,
    "minutes_before": 2880,
    "method": "email"
  },
  "tenant_id": "1er-Degré",
  "created_at": "2025-09-01T10:00:00Z",
  "updated_at": "2025-10-05T14:30:00Z"
}
